{
  "protocol": "posedoll.sensor/1",
  "device_id": "virtual-doll-001",
  "session_id": "3fc53931-d39b-4410-88b0-3b6a41ee6a10",
  "profile_id": "virtual_humanoid_44_v1",
  "profile_sha256": "a7047b7c1bdefaee37acf547d5a823cc2f89d08f5c3e9cd9710a6f6bf79ef224",
  "calibration_id": "virtual_zero_pi_v1",
  "calibration_sha256": "fe8480bff00c451f3b8eb7e3fab9bf1e65fb422ce482a08cebc7d33ba3f8989f",
  "type": "sample",
  "sequence": "1",
  "sender_monotonic_us": "1000000",
  "raw_angles_rad": [
    3.141592653589793,
    3.141592653589793,
    3.141592653589793,
    3.141592653589793,
    3.141592653589793,
    3.141592653589793,
    3.141592653589793,
    3.141592653589793,
    3.141592653589793,
    3.141592653589793,
    3.141592653589793,
    3.141592653589793,
    3.141592653589793,
    3.141592653589793,
    4.71238898038469,
    3.141592653589793,
    3.141592653589793,
    3.141592653589793,
    3.141592653589793,
    3.141592653589793,
    3.141592653589793,
    3.141592653589793,
    3.141592653589793,
    3.141592653589793,
    3.141592653589793,
    3.141592653589793,
    3.141592653589793,
    3.141592653589793,
    3.141592653589793,
    3.141592653589793,
    3.141592653589793,
    3.141592653589793,
    3.141592653589793,
    3.141592653589793,
    3.141592653589793,
    3.141592653589793,
    3.141592653589793,
    3.141592653589793,
    3.141592653589793,
    3.141592653589793,
    3.141592653589793,
    3.141592653589793,
    3.141592653589793,
    3.141592653589793
  ],
  "axis_status": [
    "valid",
    "valid",
    "valid",
    "valid",
    "valid",
    "valid",
    "valid",
    "valid",
    "valid",
    "valid",
    "valid",
    "valid",
    "valid",
    "valid",
    "valid",
    "valid",
    "valid",
    "valid",
    "valid",
    "valid",
    "valid",
    "valid",
    "valid",
    "valid",
    "valid",
    "valid",
    "valid",
    "valid",
    "valid",
    "valid",
    "valid",
    "valid",
    "valid",
    "valid",
    "valid",
    "valid",
    "valid",
    "valid",
    "valid",
    "valid",
    "valid",
    "valid",
    "valid",
    "valid"
  ]
}
